{
  "schemaVersion": 2,
  "generatedAt": "2026-07-19T12:20:33Z",
  "configuration": {
    "baseIterations": 1000000,
    "runs": 5,
    "caseFilter": []
  },
  "environment": {
    "system": "Darwin",
    "release": "27.0.0",
    "architecture": "arm64",
    "python": "3.14.3"
  },
  "procedure": {
    "steps": [
      "Write the generated implementation for each language into an isolated case directory.",
      "Compile every native implementation with its release optimization settings. Compilation time is excluded from the measurement.",
      "Emit Range to LLVM with the verified self-hosted compiler, then link the emitted module and runtime sources with clang -O3 -mcpu=native.",
      "Run every language once per round, rotating the starting language to reduce thermal, frequency, and background-load bias.",
      "Require the expected exit code and identical output on every run, then report median wall time, median CPU time, and median peak RSS."
    ],
    "commands": {
      "c": [
        "cc -O3 -mcpu=native main.c -o speed-c",
        "./speed-c <iterations>"
      ],
      "range": [
        "RangeCompiler emit-llvm Playground.range Main.ll",
        "clang -O3 -mcpu=native -Wno-override-module Main.ll <runtime-sources> -o speed-range",
        "./speed-range"
      ],
      "suite": [
        "N=<base-iterations> RUNS=<sample-count> npm run benchmarks"
      ]
    },
    "notes": [
      "The workload count is specialized per leaf; some leaves intentionally scale it down to keep total work comparable.",
      "Wall time includes process execution but excludes source generation and compilation.",
      "A result is published only when output remains stable across every measured run.",
      "Bun and TypeScript rows are omitted when their local toolchains are unavailable."
    ]
  },
  "languages": [
    "C",
    "C++",
    "Go",
    "Range",
    "Rust",
    "Swift"
  ],
  "summary": {
    "leafCount": 12,
    "runLeafCount": 12,
    "rangePassed": 12,
    "rangeNotEmitted": 0,
    "rangeFailed": 0
  },
  "categories": [
    {
      "id": "loops",
      "name": "Loops",
      "subcategories": [
        {
          "id": "while",
          "name": "While",
          "leaves": [
            {
              "id": "integer_loop",
              "name": "Sequential modulo",
              "description": "Sequential integer arithmetic and modulo dependency chain",
              "workload": {
                "count": 1000000,
                "unit": "iterations"
              },
              "runStatus": "passed",
              "rangeStatus": "passed",
              "axisMaxMilliseconds": 9.6471,
              "implementations": [
                {
                  "language": "C",
                  "syntax": "c",
                  "filename": "main.c",
                  "source": "#include <inttypes.h>\n#include <stdint.h>\n#include <stdio.h>\n#include <stdlib.h>\nint main(int argc, char **argv) {\n    int64_t n = argc > 1 ? atoll(argv[1]) : 1000000;\n    int64_t i = 0;\n    int64_t acc = 1;\n    while (i < n) {\n        acc = (acc + i * 3 + 1) % 1000003;\n        i += 1;\n    }\n    printf(\"%\" PRId64 \"\\n\", acc);\n}\n"
                },
                {
                  "language": "Range",
                  "syntax": "range",
                  "filename": "Playground.range",
                  "source": "@main {\n    let n: Int(1000000)\n    state i: Int(0)\n    state acc: Int(1)\n    while i < n {\n        acc: (acc + i * 3 + 1) % 1000003\n        i: i + 1\n    }\n    return acc % 251\n}\n"
                }
              ],
              "results": [
                {
                  "language": "C",
                  "status": "passed",
                  "wallMilliseconds": 7.313,
                  "cpuMilliseconds": 4.971,
                  "peakRssKilobytes": 1760,
                  "relativeToFastest": 1.0,
                  "relativeToC": 1.0,
                  "cpuRelativeToC": 1.0,
                  "memoryRelativeToC": 1.0,
                  "output": "16"
                },
                {
                  "language": "Range",
                  "status": "passed",
                  "wallMilliseconds": 7.4211,
                  "cpuMilliseconds": 5.487,
                  "peakRssKilobytes": 1776,
                  "relativeToFastest": 1.0148,
                  "relativeToC": 1.0148,
                  "cpuRelativeToC": 1.1038,
                  "memoryRelativeToC": 1.0091,
                  "output": "exit:16"
                },
                {
                  "language": "C++",
                  "status": "passed",
                  "wallMilliseconds": 7.5819,
                  "cpuMilliseconds": 5.093,
                  "peakRssKilobytes": 1760,
                  "relativeToFastest": 1.0368,
                  "relativeToC": 1.0368,
                  "cpuRelativeToC": 1.0245,
                  "memoryRelativeToC": 1.0,
                  "output": "16"
                },
                {
                  "language": "Rust",
                  "status": "passed",
                  "wallMilliseconds": 7.9265,
                  "cpuMilliseconds": 5.54,
                  "peakRssKilobytes": 1968,
                  "relativeToFastest": 1.0839,
                  "relativeToC": 1.0839,
                  "cpuRelativeToC": 1.1145,
                  "memoryRelativeToC": 1.1182,
                  "output": "16"
                },
                {
                  "language": "Swift",
                  "status": "passed",
                  "wallMilliseconds": 8.7646,
                  "cpuMilliseconds": 6.249,
                  "peakRssKilobytes": 2176,
                  "relativeToFastest": 1.1985,
                  "relativeToC": 1.1985,
                  "cpuRelativeToC": 1.2571,
                  "memoryRelativeToC": 1.2364,
                  "output": "16"
                },
                {
                  "language": "Go",
                  "status": "passed",
                  "wallMilliseconds": 8.9325,
                  "cpuMilliseconds": 6.963,
                  "peakRssKilobytes": 4096,
                  "relativeToFastest": 1.2215,
                  "relativeToC": 1.2215,
                  "cpuRelativeToC": 1.4007,
                  "memoryRelativeToC": 2.3273,
                  "output": "16"
                }
              ]
            }
          ]
        },
        {
          "id": "if",
          "name": "If",
          "leaves": [
            {
              "id": "loop_if",
              "name": "75% taken",
              "description": "Repeated one-sided conditional with a 75% taken branch",
              "workload": {
                "count": 1000000,
                "unit": "iterations"
              },
              "runStatus": "passed",
              "rangeStatus": "passed",
              "axisMaxMilliseconds": 8.6997,
              "implementations": [
                {
                  "language": "C",
                  "syntax": "c",
                  "filename": "main.c",
                  "source": "#include <inttypes.h>\n#include <stdint.h>\n#include <stdio.h>\n#include <stdlib.h>\nint main(int argc, char **argv) {\n    int64_t n = argc > 1 ? atoll(argv[1]) : 1000000;\n    int64_t i = 0, acc = 1;\n    while (i < n) {\n        if (i % 4 != 0) acc = (acc + i * 3 + 1) % 1000003;\n        i += 1;\n    }\n    printf(\"%\" PRId64 \"\\n\", acc);\n}\n"
                },
                {
                  "language": "Range",
                  "syntax": "range",
                  "filename": "Playground.range",
                  "source": "@main {\n    let n: Int(1000000)\n    state i: Int(0)\n    state acc: Int(1)\n    while i < n {\n        if i % 4 != 0 {\n            acc: (acc + i * 3 + 1) % 1000003\n        }\n        i: i + 1\n    }\n    return acc % 251\n}\n"
                }
              ],
              "results": [
                {
                  "language": "C++",
                  "status": "passed",
                  "wallMilliseconds": 6.4037,
                  "cpuMilliseconds": 4.308,
                  "peakRssKilobytes": 1776,
                  "relativeToFastest": 1.0,
                  "relativeToC": 0.993,
                  "cpuRelativeToC": 1.0228,
                  "memoryRelativeToC": 1.0091,
                  "output": "375010"
                },
                {
                  "language": "C",
                  "status": "passed",
                  "wallMilliseconds": 6.4488,
                  "cpuMilliseconds": 4.212,
                  "peakRssKilobytes": 1760,
                  "relativeToFastest": 1.0071,
                  "relativeToC": 1.0,
                  "cpuRelativeToC": 1.0,
                  "memoryRelativeToC": 1.0,
                  "output": "375010"
                },
                {
                  "language": "Range",
                  "status": "passed",
                  "wallMilliseconds": 6.4896,
                  "cpuMilliseconds": 4.281,
                  "peakRssKilobytes": 1760,
                  "relativeToFastest": 1.0134,
                  "relativeToC": 1.0063,
                  "cpuRelativeToC": 1.0164,
                  "memoryRelativeToC": 1.0,
                  "output": "exit:16"
                },
                {
                  "language": "Swift",
                  "status": "passed",
                  "wallMilliseconds": 7.3069,
                  "cpuMilliseconds": 4.691,
                  "peakRssKilobytes": 2192,
                  "relativeToFastest": 1.141,
                  "relativeToC": 1.1331,
                  "cpuRelativeToC": 1.1137,
                  "memoryRelativeToC": 1.2455,
                  "output": "375010"
                },
                {
                  "language": "Rust",
                  "status": "passed",
                  "wallMilliseconds": 7.8095,
                  "cpuMilliseconds": 4.904,
                  "peakRssKilobytes": 1968,